"crunch","website","Crunch is a wordlist generator where you can specify a standard character set or a character set you specify. crunch can generate all possible combinations and permutations."
"Multimon-NG","website","MultimonNG a fork of multimon. It decodes a large number of digital transmission modes."
"sctpscan","website","SCTPscan is a tool to scan SCTP enabled machines. Typically, these are Telecom oriented machines carrying SS7 and SIGTRAN over IP. Using SCTPscan, you can find entry points to Telecom networks. This is especially useful when doing pentests on Telecom Core Network infrastructures."
"copy-router-config","website","Copies configuration files from Cisco devices running SNMP.&lt;p&gt;"
"fimap","website","fimap is a little python tool which can find, prepare, audit, exploit and even google automaticly for local and remote file inclusion bugs in webapps. fimap should be something like sqlmap just for LFI/RFI bugs instead of sql injection."
"hash-identifier","website","Software to identify the different types of hashes used to encrypt data and especially passwords."
"Bluelog","website","Bluelog is a Linux Bluetooth scanner with optional daemon mode and web front-end, designed for site surveys and traffic monitoring. It&#039;s intended to be run for long periods of time in a static location to determine how many discoverable Bluetooth devices there are in the area."
"Bluesnarfer","website","A Bluetooth bluesnarfing Utility."
"ShellNoob","website","Writing shellcodes has always been super fun, but some parts are extremely boring and error prone. Focus only on the fun part, and use ShellNoob!"
"SSLsplit","website","SSLsplit is a tool for man-in-the-middle attacks against SSL/TLS encrypted network connections. Connections are transparently intercepted through a network address translation engine and redirected to SSLsplit. SSLsplit terminates SSL/TLS and initiates a new SSL/TLS connection to the original destination address, while logging all data transmitted."
"dnsmap","website","dnsmap was originally released back in 2006 and was inspired by the fictional story &quot;The Thief No One Saw&quot; by Paul Craig, which can be found in the book &quot;Stealing the Network - How to 0wn the Box&quot;."
"content="Wifi","website","This script creates five monitor mode interfaces, four are used as APs and the fifth is used for airodump-ng. To make things easier, rather than having five windows all this is done in a screen session which allows you to switch between screens to see what is going on. All sessions are labelled so you know which is which."
"Foremost","website","Foremost is a forensic program to recover lost files based on their headers, footers, and internal data structures. Foremost can work on image files, such as those generated by dd, Safeback, Encase, etc, or directly on a drive."
"Airserv-ng","website","Airserv-ng is a wireless card server that allows multiple wireless application programs to independently use a wireless card via a client-server TCP network connection."
"jboss-autopwn","website","This JBoss script deploys a JSP shell on the target JBoss AS server. Once deployed, the script uses its upload and command execution capability to provide an interactive session."
"enumIAX","website","enumIAX is an Inter Asterisk Exchange protocol username brute-force enumerator. enumIAX may operate in two distinct modes; Sequential Username Guessing or Dictionary Attack."
"BlueRanger","website","BlueRanger is a simple Bash script which uses Link Quality to locate Bluetooth device radios. It sends l2cap (Bluetooth) pings to create a connection between Bluetooth interfaces, since most devices allow pings without any authentication or authorization. The higher the link quality, the closer the device (in theory)."
"SMBMap","website","SMBMap allows users to enumerate samba share drives across an entire domain. List share drives, drive permissions, share contents, upload/download functionality, file name auto-download pattern matching, and even execute remote commands."
"THC-pptp-bruter","website","Brute force program against pptp vpn endpoints (tcp port 1723). Fully standalone. Supports latest MSChapV2 authentication. Tested against Windows and Cisco gateways. Exploits a weakness in Microsoft&#039;s anti-brute force implementation which makes it possible to try 300 passwords the second."
"RidEnum","website","Rid Enum is a RID cycling attack that attempts to enumerate user accounts through null sessions and the SID to RID enum. If you specify a password file, it will automatically attempt to brute force the user accounts when its finished enumerating."
"Airtun-ng","website","Airtun-ng is a virtual tunnel interface creator and is included in the aircrack-ng package."
"DHCPig","website","DHCPig initiates an advanced DHCP exhaustion attack. It will consume all IPs on the LAN, stop new users from obtaining IPs, release any IPs in use, then for good measure send gratuitous ARP and knock all windows hosts offline."
"Gqrx","website","Gqrx is a software defined radio receiver powered by the GNU Radio SDR framework and the Qt graphical toolkit. Gqrx supports many of the SDR hardware available, including Funcube Dongles, rtl-sdr, HackRF and USRP devices."
"Skipfish","website","Skipfish is an active web application security reconnaissance tool. It prepares an interactive sitemap for the targeted site by carrying out a recursive crawl and dictionary-based probes. The resulting map is then annotated with the output from a number of active (but hopefully non-disruptive) security checks."
"iaxflood","website","A UDP Inter-Asterisk_eXchange (i.e. IAX) packet was captured from an IAX channel between two Asterisk IP PBX&#039;s. The content of that packet is the source of the payload for the attack embodied by this tool."
"rcracki-mt","website","rcracki_mt is a modified version of rcrack which supports hybrid and indexed tables. In addition to that, it also adds multi-core support."
"oclgausscrack","website","The goal of the program is to crack the verification hash of the encrypted payload of the Gauss Virus. Uses OpenCL to accelerate the 10k MD5 loop."
"edb-debugger","website","A Linux equivalent of the famous Olly debugger on the Windows platform."
"mfcuk","website","Toolkit containing samples and various tools based on and around libnfc and crapto1, with emphasis on Mifare Classic NXP/Philips RFID cards."
"braa","website","Braa is a mass snmp scanner. The intended usage of such a tool is of course making SNMP queries - but unlike snmpget or snmpwalk from net-snmp, it is able to query dozens or hundreds of hosts simultaneously, and in a single process. Thus, it consumes very few system resources and does the scanning VERY fast."
"SQLdict","website","SQLdict is a dictionary attack tool for SQL Server."
"Wesside-ng","website","Wesside-ng is an auto-magic tool which incorporates a number of techniques to seamlessly obtain a WEP key in minutes."
"URLCrazy","website","Generate and test domain typos and variations to detect and perform typo squatting, URL hijacking, phishing, and corporate espionage."
"hURL","website","hURL is a small utility that can encode and decode between multiple formats."
"Faraday","website","Faraday introduces a new concept - IPE (Integrated Penetration-Test Environment) a multiuser Penetration test IDE. Designed for distribution, indexation and analysis of the data generated during a security audit."
"ophcrack","website","Ophcrack is a free Windows password cracker based on rainbow tables. It is a very efficient implementation of rainbow tables done by the inventors of the method. It comes with a Graphical User Interface and runs on multiple platforms."
"keimpx","website","keimpx is an open source tool, released under a modified version of Apache License 1.1. It can be used to quickly check for valid credentials across a network over SMB."
"ident-user-enum","website","ident-user-enum on Kali Linux is a simple PERL script to query the ident service (113/TCP) in order to determine the owner of the process listening on each TCP port of a target system."
"Arduino","website","Arduino is an open-source electronics prototyping platform based on flexible, easy-to-use hardware and software. It&#039;s intended for artists, designers, hobbyists, and anyone interested in creating interactive objects or environments."
"SniffJoke","website","SniffJoke is an application for Linux that handle transparently your TCP connection, delaying, modifyng and inject fake packets inside your transmission, make them almost impossible to be correctly readed by a passive wiretapping technology (IDS or sniffer)."
"sbd","website","sbd is a Netcat-clone, designed to be portable and offer strong encryption. It runs on Unix-like operating systems and on Microsoft Win32. sbd features AES-CBC-128 + HMAC-SHA1 encryption (by Christophe Devine), program execution (-e option), choosing source port, continuous reconnection with delay, and some other nice features. sbd supports TCP/IP communication only."
"SSLyze","website","SSLyze is a Python tool that can analyze the SSL configuration of a server by connecting to it. It is designed to be fast and comprehensive, and should help organizations and testers identify misconfigurations affecting their SSL servers."
"Gobuster","website","Gobuster is a web content scanner that looks for existing (and/or hidden) web objects. It basically works by launching a dictionary based attack against a web server and analyzing the response."
"pipal","website","All this tool does is to give you the stats and the information to help you analyse the passwords. The real work is done by you in interpreting the results."
"sslcaudit","website","The goal of sslcaudit project is to develop a utility to automate testing SSL/TLS clients for resistance against MITM attacks. It might be useful for testing a thick client, a mobile application, an appliance, pretty much anything communicating over SSL/TLS over TCP."
"DirBuster","website","DirBuster is a multi threaded java application designed to brute force directories and files names on web/application servers."
"WOL-E","website","WOL-E is a suite of tools for the Wake on LAN feature of network attached computers, this is now enabled by default on many Apple computers."
"content="Linux","website","As the name suggests, this is a Linux Exploit Suggester, with no frills and no fancy features; just a simple script to keep track of vulnerabilities and suggest possible exploits to use to gain ‘root‘ on a legitimate penetration test, or governing examining body."
"TrueCrack","website","TrueCrack is a brute-force password cracker for TrueCrypt volumes. It works on Linux and it is optimized for Nvidia Cuda technology."
"SidGuesser","website","Guesses sids/instances against an Oracle database according to a predefined dictionary file. The speed is slow (80-100 guesses per second) but it does the job."
"Inundator","website","Inundator is a multi-threaded, queue-driven, anonymous intrusion detection false positives generator with support for multiple targets."
"Capstone","website","Capstone is a disassembly framework with the target of becoming the ultimate disasm engine for binary analysis and reversing in the security community."
"theHarvester","website","The objective of this program is to gather emails, subdomains, hosts, employee names, open ports and banners from different public sources like search engines, PGP key servers and SHODAN computer database."
"Powerfuzzer","website","Powerfuzzer is a highly automated and fully customizable web fuzzer (HTTP protocol based application fuzzer) based on many other Open Source fuzzers available and information gathered from numerous security resources and websites. It was designed to be user friendly, modern, effective and working."
"Sublist3r","website","Sublist3r is a python tool designed to enumerate subdomains of websites using OSINT. It helps penetration testers and bug hunters collect and gather subdomains for the domain they are targeting. Sublist3r enumerates subdomains using many search engines such as Google, Yahoo, Bing, Baidu, and Ask."
"cisco-ocs","website","A mass Cisco scanning tool."
"Nishang","website","Nishang is a framework and collection of scripts and payloads which enables usage of PowerShell for offensive security and post exploitation during Penetraion Tests. The scripts are written on the basis of requirement by the author during real Penetration Tests."
"Automater","website","Automater is a URL/Domain, IP Address, and Md5 Hash OSINT tool aimed at making the analysis process easier for intrusion Analysts. Given a target (URL, IP, or HASH) or a file full of targets Automater will return relevant results from sources like the following: IPvoid.com, Robtex.com, Fortiguard.com, unshorten.me, Urlvoid.com, Labs.alienvault.com, ThreatExpert, VxVault, and VirusTotal."
"wordlists","website","This package contains the rockyou wordlist and contains symlinks to a number of other password files present in the Kali Linux distribution. This package has an installation size of 134 MB."
"SET","website","The Social-Engineer Toolkit is an open-source penetration testing framework designed for Social-Engineering. SET has a number of custom attack vectors that allow you to make a believable attack in a fraction of the time. "
"phrasendrescher","website","phrasen|drescher (p|d) is a modular and multi processing pass phrase cracking tool. It comes with a number of plugins but a simple plugin API allows an easy development of new plugins."
"twofi","website","An interesting idea originally released on the &quot;7 Habits of Highly Effective Hackers&quot; blog was to use Twitter to help generate those lists based on searches for keywords related to the list that is being cracked. This idea has been expanded into twofi which will take multiple search terms and return a word list sorted by most common first."
"ua-tester","website","This tool is designed to automatically check a given URL using a list of standard and non-standard User Agent strings provided by the user (1 per line). The results of these checks are then reported to the user for further manual analysis where required."
"Valgrind","website","Valgrind is a system for debugging and profiling Linux programs. With its tool suite you can automatically detect many memory management and threading bugs, avoiding hours of frustrating bug-hunting and making your programs more stable. You can also perform detailed profiling to help speed up your programs and use Valgrind to build new tools."
"http-tunnel","website","Creates a bidirectional virtual data stream tunnelled in HTTP requests. The requests can be sent via a HTTP proxy if so desired. This can be useful for users behind restrictive firewalls. If WWW access is allowed through a HTTP proxy, it&#039;s possible to use httptunnel and, say, telnet or PPP to connect to a computer outside the firewall.&lt;p&gt;"
"RegRipper","website","RegRipper is an open source tool, written in Perl, for extracting/parsing information (keys, values, data) from the Registry and presenting it for analysis."
"Airmon-ng","website","Airmon-ng is included in the aircrack-ng package and is used to enable and disable monitor mode on wireless interfaces. It may also be used to go back from monitor mode to managed mode."
"Fierce","website","First what Fierce is not. Fierce is not an IP scanner, it is not a DDoS tool, it is not designed to scan the whole Internet or perform any un-targeted attacks. It is meant specifically to locate likely targets both inside and outside a corporate network."
"Wfuzz","website","Wfuzz is a tool designed for bruteforcing Web Applications, it can be used for finding resources not linked (directories, servlets, scripts, etc), bruteforce GET and POST parameters for checking different kind of injections (SQL, XSS, LDAP,etc), bruteforce Forms parameters (User/Password), Fuzzing,etc."
"SlowHTTPTest","website","SlowHTTPTest is a highly configurable tool that simulates some Application Layer Denial of Service attacks. It works on majority of Linux platforms, OSX and Cygwin - a Unix-like environment and command-line interface for Microsoft Windows."
"MagicTree","website","MagicTree is a penetration tester productivity tool. It is designed to allow easy and straightforward data consolidation, querying, external command execution and report generation."
"Sakis3G","website","Sakis3G is a tweaked shell script which is supposed to work out-of-the-box for establishing a 3G connection with any combination of modem or operator. It automagically setups your USB or Bluetooth™ modem, and may even detect operator settings. You should try it when anything else fails."
"pdf-parser","website","This tool will parse a PDF document to identify the fundamental elements used in the analyzed file. It will not render a PDF document."
"CryptCat","website","CryptCat is a simple Unix utility which reads and writes data across network connections, using TCP or UDP protocol while encrypting the data being transmitted. It is designed to be a reliable &quot;back-end&quot; tool that can be used directly or easily driven by other programs and scripts."
"masscan","website","This is the fastest Internet port scanner. It can scan the entire Internet in under 6 minutes, transmitting 10 million packets per second."
"Webshells","website","A collection of webshells for ASP, ASPX, CFM, JSP, Perl, and PHP servers.&lt;p&gt;"
"mfoc","website","MFOC is an open source implementation of &quot;offline nested&quot; attack by Nethemba. This program allow to recover authentication keys from MIFARE Classic card."
"CmosPwd","website","CmosPwd is a cross-platform tool to decrypt password stored in CMOS used to access a computer&#039;s BIOS setup."
"DNSRecon","website","A powerful DNS enumeration script"
"t50","website","Multi-protocol packet injector tool for *nix systems, actually supporting 15 protocols. Features: - Flooding - CIDR support - TCP, UDP, ICMP, IGMPv2, IGMPv3, EGP, DCCP, RSVP, RIPv1, RIPv2, GRE, ESP, AH, EIGRP and OSPF support. - TCP Options. - High performance. - Can hit about 1.000.000 packets per second."
"TLSSLed","website","TLSSLed is a Linux shell script whose purpose is to evaluate the security of a target SSL/TLS (HTTPS) web server implementation. It is based on sslscan, a thorough SSL/TLS scanner that is based on the openssl library, and on the &quot;openssl s_client&quot; command line tool."
"ohrwurm","website","ohrwurm is a small and simple RTP fuzzer that has been successfully tested on a small number of SIP phones."
"inviteflood","website","A tool to perform SIP/SDP INVITE message flooding over UDP/IP."
"CutyCapt","website","CutyCapt is a small cross-platform command-line utility to capture WebKit&#039;s rendering of a web page into a variety of vector and bitmap formats, including SVG, PDF, PS, PNG, JPEG, TIFF, GIF, and BMP."
"Doona","website","Doona is a fork of the Bruteforce Exploit Detector Tool (BED). BED is a program which is designed to check daemons for potential buffer overflows, format string bugs etc."
"snmp-check","website","Like to snmpwalk, snmpcheck allows you to enumerate the SNMP devices and places the output in a very human readable friendly format. It could be useful for penetration testing or systems monitoring. Distributed under GPL license and based on &quot;Athena-2k&quot; script by jshaw."
"Cymothoa","website","Cymothoa is a stealth backdooring tool, that inject backdoor&#039;s shellcode into an existing process. The tool uses the ptrace library (available on nearly all * nix), to manipulate processes and infect them."
"Metagoofil","website","Metagoofil is an information gathering tool designed for extracting metadata of public documents (pdf,doc,xls,ppt,docx,pptx,xlsx) belonging to a target company."
"content="jSQL","website","jSQL Injection is a lightweight application used to find database information from a distant server. jSQL is free, open source and cross-platform (Windows, Linux, Mac OS X, Solaris)."
"Yersinia","website","Yersinia is a framework for performing layer 2 attacks. It is designed to take advantage of some weakeness in different network protocols. It pretends to be a solid framework for analyzing and testing the deployed networks and systems."
"CDPSnarf","website","
"&lt;p style=&quot;text-align: justify;&quot;&gt;CDPSnarf is a network sniffer exclusively written to extract information from CDP packets."
"content="iPhone","website","iPhone Backup Analyzer is an utility designed to easily browse through the backup folder of an iPhone (or any other iOS device). Read configuration files, browse archives, lurk into databases, and so on."
"dc3dd","website","dc3dd is a patched version of GNU dd with added features for computer forensics:. * on the fly hashing (md5, sha-1, sha-256, and sha-512) * possibility to write errors to a file * group errors in the error log * pattern wiping * progress report * possiblity to split output "
"EyeWitness","website","EyeWitness is designed to take screenshots of websites, RDP services, and open VNC servers, provide some server header info, and identify default credentials if possible."
"apktool","website","It is a tool for reverse engineering 3rd party, closed, binary Android apps. It can decode resources to nearly original form and rebuild them after making some  modifications; it makes possible to debug smali code step by step."
"rtpinsertsound","website","A tool to insert audio into a specified audio (i.e. RTP) stream was created in the August - September 2006 timeframe. The tool is named rtpinsertsound."
"Aircrack-ng","website","Aircrack-ng is an 802.11 WEP and WPA-PSK keys cracking program that can recover keys once enough data packets have been captured. It implements the standard FMS attack along with some optimizations like KoreK attacks, as well as the all-new PTW attack."
"Nmap","website","Nmap (&quot;Network Mapper&quot;) is a free and open source (license) utility for network discovery and security auditing. Many systems and network administrators also find it useful for tasks such as network inventory, managing service upgrade schedules, and monitoring host or service uptime."
"HexorBase","website","HexorBase is a database application designed for administering and auditing multiple database servers simultaneously from a centralized location, it is capable of performing SQL queries and bruteforce attacks against common database servers (MySQL, SQLite, Microsoft SQL Server, Oracle, PostgreSQL )."
"hamster-sidejack","website","Hamster is a tool or &quot;sidejacking&quot;. It acts as a proxy server that replaces your cookies with session cookies stolen from somebody else, allowing you to hijack their sessions. Cookies are sniffed using the Ferret program. You need a copy of that as well."
"VoIPHopper","website","VoIP Hopper is a GPLv3 licensed security tool, written in C, that rapidly runs a VLAN Hop into the Voice VLAN on specific ethernet switches. VoIP Hopper does this by mimicking the behavior of an IP Phone, in Cisco, Avaya, Nortel, and Alcatel-Lucent environments."
"THC-Hydra","website","Hydra is a parallelized login cracker which supports numerous protocols to attack. It is very fast and flexible, and new modules are easy to add. This tool makes it possible for researchers and security consultants to show how easy it would be to gain unauthorized access to a system remotely."
"content="Burp","website","Burp Suite is an integrated platform for performing security testing of web applications. Its various tools work seamlessly together to support the entire testing process, from initial mapping and analysis of an application&#039;s attack surface, through to finding and exploiting security vulnerabilities."
"Firewalk","website","Firewalk is an active reconnaissance network security tool that attempts to determine what layer 4 protocols a  given IP forwarding device will pass. Firewalk  works  by sending out TCP or UDP packets with a TTL one greater than the targeted gateway."
"RainbowCrack","website","RainbowCrack is a general propose implementation of Philippe Oechslin&#039;s faster time-memory trade-off technique. It crack hashes with rainbow tables."
"Paros","website","A Java based HTTP/HTTPS proxy for assessing web application vulnerability. It supports editing/viewing HTTP messages on-the-fly. Other featuers include spiders, client certificate, proxy-chaining, intelligent scanning for XSS and SQL injections etc."
"rtpbreak","website","With rtpbreak you can detect, reconstruct and analyze any RTP session. It doesn&#039;t require the presence of RTCP packets and works independently form the used signaling protocol (SIP, H.323, SCCP, ...)."
"exploitdb","website","Searchable archive from The Exploit Database."
"content="Maltego","website","Maltego is a unique platform developed to deliver a clear threat picture to the environment that an organization owns and operates. Maltego’s unique advantage is to demonstrate the complexity and severity of single points of failure as well as trust relationships that exist currently within the scope of your infrastructure. "
"Ncrack","website","Ncrack is a high-speed network authentication cracking tool. It was built to help companies secure their networks by proactively testing all their hosts and networking devices for poor passwords. Security professionals also rely on Ncrack when auditing their clients."
"FunkLoad","website","FunkLoad is a functional and load web tester, written in Python."
"responder","website","This tool is first an LLMNR and NBT-NS responder, it will answer to *specific* NBT-NS (NetBIOS Name Service) queries based on their name suffix (see: http://support.microsoft.com/kb/163409). By default, the tool will only answers to File Server Service request, which is for SMB. The concept behind this, is to target our answers, and be stealthier on the network."
