"ace-voip","website","ACE (Automated Corporate Enumerator) is a simple yet powerful VoIP Corporate Directory enumeration tool that mimics the behavior of an IP Phone in order to  download the name and extension entries that a given phone can display on its screen interface."
"hping3","website","hping is a command-line oriented TCP/IP packet assembler/analyzer. The interface is inspired to the ping(8) unix command, but hping isn&#039;t only able to send ICMP echo requests. It supports TCP, UDP, ICMP and RAW-IP protocols, has a traceroute mode, the ability to send files between a covered channel, and many other features."
"Guymager","website","Guymager is a free forensic imager for media acquisition."
"protos-sip","website","The purpose of this test-suite is to evaluate implementation level security and robustness of Session Initiation Protocol (SIP) implementations."
"Tkiptun-ng","website","Tkiptun-ng is the proof-of-concept implementation the WPA/TKIP attack. This attack is described in the paper, Practical attacks against WEP and WPA written by Martin Beck and Erik Tews. The paper describes advanced attacks on WEP and the first practical attack on WPA."
"Hashcat","website","hashcat is the world&#039;s fastest and most advanced password recovery utility, supporting five unique modes of attack for over 200 highly-optimized hashing algorithms. hashcat currently supports CPUs, GPUs, and other hardware accelerators on Linux, Windows, and OSX, and has facilities to help enable distributed password cracking."
"android-sdk","website","The Android SDK provides you the API libraries and developer tools necessary to build, test, and debug apps for Android."
"content="RTLSDR","website","
"&lt;p style=&quot;text-align: justify;&quot;&gt;A cross platform Python frequency scanning GUI for USB TV dongles, using the OsmoSDR rtl-sdr library."
"deblaze","website","Through the use of the Flex programming model and the ActionScript language, Flash Remoting was born. Flash applications can make request to a remote server to call server side functions, such as looking up accounts, retrieving additional data and graphics, and performing complex business operations."
"fragroute","website","fragroute intercepts, modifies, and rewrites egress traffic destined for a specified host, implementing most of the attacks described in the Secure Networks &quot;Insertion, Evasion, and Denial of Service: Eluding Network Intrusion Detection&quot; paper of January 1998."
"lbd","website","lbd (load balancing detector) detects if a given domain uses DNS and/or HTTP Load-Balancing (via Server: and Date: header and diffs between server answers)."
"dns2tcp","website","Dns2tcp is a network tool designed to relay TCP connections through DNS traffic. Encapsulation is done on the TCP level, thus no specific driver is needed (i.e: TUN/TAP). Dns2tcp client doesn&#039;t need to be run with specific privileges."
"sfuzz","website","simple fuzz is exactly what it sounds like - a simple fuzzer. don&#039;t mistake simple with a lack of fuzz capability. this fuzzer has two network modes of operation, an output mode for developing command line fuzzing scripts, as well as taking fuzzing strings from literals and building strings from sequences."
"Airodump-ng","website","Airodump-ng is included in the aircrack-ng package and is used for packet capturing of raw 802.11 frames. It is ideal for collecting WEP IVs for use with aircrack-ng. If you have a GPS receiver connected to the computer, airodump-ng can log the coordinates of the discovered access points."
"dnswalk","website","dnswalk is a DNS debugger. It performs zone transfers of specified domains, and checks the database in numerous ways for internal consistency, as well as accuracy."
"DAVTest","website","DAVTest tests WebDAV enabled servers by uploading test executable files, and then (optionally) uploading files which allow for command execution or other actions directly on the target. It is meant for penetration testers to quickly and easily determine if enabled DAV services are exploitable."
"XSSer","website","Cross Site &quot;Scripter&quot; (aka XSSer) is an automatic -framework- to detect, exploit and report XSS vulnerabilities in web-based applications. It contains several options to try to bypass certain filters, and various special techniques of code injection."
"Wireshark","website","Wireshark is the world&#039;s foremost network protocol analyzer. It lets you see what&#039;s happening on your network at a microscopic level. It is the de facto (and often de jure) standard across many industries and educational institutions. Wireshark development thrives thanks to the contributions of networking experts across the globe. It is the continuation of a project that started in 1998."
"Maskprocessor","website","Maskprocessor is a High-Performance word generator with a per-position configureable charset packed into a single stand-alone binary. Maskprocessor is a High-Performance word generator with a per-position configureable charset packed into a single stand-alone binary."
"enum4linux","website","A Linux alternative to enum.exe for enumerating data from Windows and Samba hosts."
"joomscan","website","Joomla! is probably the most widely-used CMS out there due to its flexibility, user-friendlinesss, extensibility to name a few. So, watching its vulnerabilities and adding such vulnerabilities as KB to Joomla scanner takes ongoing activity."
"Packetforge-ng","website","The purpose of packetforge-ng is to create encrypted packets that can subsequently be used for injection. You may create various types of packets such as arp requests, UDP, ICMP and custom packets. The most common use is to create ARP requests for subsequent injection."
"diStorm3","website","diStorm is a lightweight, easy-to-use and fast decomposer library. diStorm disassembles instructions in 16, 32 and 64 bit modes. Supported instruction sets: FPU, MMX, SSE, SSE2, SSE3, SSSE3, SSE4, 3DNow! (w/ extensions), new x86-64 instruction sets, VMX, AMD&#039;s SVM and AVX!"
"rtpflood","website","A command line tool used to flood any device that is processing RTP.&lt;p&gt;"
"fiked","website","FakeIKEd, or fiked for short, is a fake IKE daemon supporting just enough of the standards and Cisco extensions to attack commonly found insecure Cisco VPN PSK+XAUTH based IPsec authentication setups in what could be described as a semi MitM attack."
"nbtscan-unixwiz","website","nbtscan-unixwiz is a command-line tool that scans for open NETBIOS nameservers on a local or remote TCP/IP network, and this is a first step in finding of open shares."
"Lynis","website","Lynis is an open source security auditing tool. Its main goal is to audit and harden Unix and Linux based systems. It scans the system by performing many security control checks. Examples include searching for installed software and determine possible configuration flaws."
"CeWL","website","CeWL is a ruby app which spiders a given url to a specified depth, optionally following external links, and returns a list of words which can then be used for password crackers such as John the Ripper."
"iSMTP","website","Test for SMTP user enumeration (RCPT TO and VRFY), internal spoofing, and relay.&lt;p&gt;"
"dnsenum","website","Multithreaded perl script to enumerate DNS information of a domain and to discover non-contiguous ip blocks."
"Miranda","website","Miranda is a Python-based Universal Plug-N-Play client application designed to discover, query and interact with UPNP devices, particularly Internet Gateway Devices (aka, routers). It can be used to audit UPNP-enabled devices on a network for possible vulnerabilities."
"content="Ghost","website","Ghost Phisher is a Wireless and Ethernet security auditing and attack software program written using the Python Programming Language and the Python Qt GUI library, the program is able to emulate access points and deploy."
"WebSploit","website","WebSploit Is an open source project for web application assessments."
"DMitry","website","DMitry (Deepmagic Information Gathering Tool) is a UNIX/(GNU)Linux Command Line Application coded in C. DMitry has the ability to gather as much information as possible about a host. Base functionality is able to gather possible subdomains, email addresses, uptime information, tcp port scan, whois lookups, and more."
"PadBuster","website","PadBuster is a Perl script for automating Padding Oracle Attacks. PadBuster provides the capability to decrypt arbitrary ciphertext, encrypt arbitrary plaintext, and perform automated response analysis to determine whether a request is vulnerable to padding oracle attacks."
"FreeRADIUS-WPE","website","A patch for the popular open-source FreeRADIUS implementation to demonstrate RADIUS impersonation vulnerabilities"
"acccheck","website","The tool is designed as a password dictionary attack tool that targets windows authentication via the SMB protocol. It is really a wrapper script around the &#039;smbclient&#039; binary, and as a result is dependent on it for its execution."
"Binwalk","website","Binwalk is a tool for searching a given binary image for embedded files and executable code. Specifically, it is designed for identifying files and code embedded inside of firmware images."
"DotDotPwn","website","It&#039;s a very flexible intelligent fuzzer to discover traversal directory vulnerabilities in software such as HTTP/FTP/TFTP servers, Web platforms such as CMSs, ERPs, Blogs, etc. "
"CaseFile","website","CaseFile is the little brother to Maltego. It targets a unique market of &#039;offline&#039; analysts whose primary sources of information are not gained from the open-source intelligence side or can be programmatically queried. We see these people as investigators and analysts who are working &#039;on the ground&#039;, getting intelligence from other people in the team and building up an information map of their investigation."
"YARA","website","With YARA you can create descriptions of malware families based on textual or binary patterns contained on samples of those families. Each description consists of a set of strings and a boolean expression which determines its logic. This package contains the command-line interface."
"bing-ip2hosts","website","Bing.com is a search engine owned by Microsoft formerly known as MSN Search and Live Search. It has a unique feature to search for websites hosted on a specific IP address. Bing-ip2hosts uses this feature to enumerate all hostnames which Bing has indexed for a specific IP address."
"ntop","website","ntop is a tool that shows the network usage, similar to what the popular top Unix command does. ntop is based on pcapture (ftp://ftp.ee.lbl.gov/pcapture.tar.Z) and it has been written in a portable way in order to virtually run on every Unix platform."
"coWPAtty","website","Implementation of an offline dictionary attack against WPA/WPA2 networks using PSK-based authentication (e.g. WPA-Personal)."
"Vega","website","Vega is a free and open source scanner and testing platform to test the security of web applications. Vega can help you find and validate SQL Injection, Cross-Site Scripting (XSS), inadvertently disclosed sensitive information, and other vulnerabilities. It is written in Java."
"unix-privesc-check","website","Unix-privesc-checker is a script that runs on Unix systems (tested on Solaris 9, HPUX 11, Various Linuxes, FreeBSD 6.2). It tries to find misconfigurations that could allow local unprivileged users to escalate privileges to other users or to access local apps (e.g. databases)."
"polenum","website","polenum is a python script which uses the Impacket Library from CORE Security Technologies to extract the password policy information from a windows machine."
"isr-evilgrade","website","Evilgrade is a modular framework that allows the user to take advantage of poor upgrade implementations by injecting fake updates. It comes with pre-made binaries (agents), a working default configuration for fast pentests, and has it&#039;s own WebServer and DNSServer modules."
"dos2unix","website","This package contains utilities dos2unix, unix2dos, mac2unix, unix2mac to convert the line endings of text files between UNIX (LF), DOS (CRLF) and Mac (CR) formats."
"content="Fern","website","Fern Wifi Cracker is a Wireless security auditing and attack software program written using the Python Programming Language and the Python Qt GUI library, the program is able to crack and recover WEP/WPA/WPS keys and also run other network based attacks on wireless or ethernet based networks."
"apache-users","website","This Perl script will enumerate the usernames on any system that uses Apache with the UserDir module."
"ProxyStrike","website","ProxyStrike is an active Web Application Proxy. It&#039;s a tool designed to find vulnerabilities while browsing an application. It was created because the problems we faced in the pentests of web applications that depends heavily on Javascript, not many web scanners did it good in this stage, so we came with this proxy."
"patator","website","Patator is a multi-purpose brute-forcer, with a modular design and a flexible usage."
"cherrytree","website","A hierarchical note taking application, featuring rich text and syntax highlighting, storing data in a single xml or sqlite file."
"wifiphisher","website","Wifiphisher is an effective rogue Access Point tool downloaded by hundreds of Wi-Fi hackers everyday. It is free and open source software currently available for Linux."
"redfang","website","RedFang is a small proof-of-concept application to find non discoverable Bluetooth devices. This is done by brute forcing the last six (6) bytes of the Bluetooth address of the device and doing a read_remote_name()."
"fragrouter","website","Fragrouter is a network intrusion detection evasion toolkit. It implements most of the attacks described in the Secure Networks &quot;Insertion, Evasion, and Denial of Service: Eluding Network Intrusion Detection&quot; paper of January 1998."
"BlindElephant","website","The BlindElephant Web Application Fingerprinter attempts to discover the version of a (known) web application by comparing static files at known locations against precomputed hashes for versions of those files in all all available releases. The technique is fast, low-bandwidth, non-invasive, generic, and highly automatable"
"Kismet","website","Kismet is an 802.11 layer-2 wireless network detector, sniffer, and intrusion detection system. It will work with any wireless card that supports raw monitoring (rfmon) mode, and can sniff 802.11a/b/g/n traffic. It can use other programs to play audio alarms for network events, read out network summaries, or provide GPS coordinates."
"Intersect","website","
"&lt;p style=&quot;text-align: justify;&quot;&gt;Intersect 2.5 is the second major release in the project line. This release is much different from the previous,"
"Spooftooph","website","Spooftooph is designed to automate spoofing or cloning Bluetooth device information. Make a Bluetooth device hide in plain site."
"Wifitap","website","Wifitap is a proof of concept for communication over WiFi networks using traffic injection. Wifitap allows any application do send and receive IP packets using 802.11 traffic capture and injection over a WiFi network simply configuring wj0."
"Uniscan","website","Uniscan is a simple Remote File Include, Local File Include and Remote Command Execution vulnerability scanner."
"Dradis","website","
"&lt;p style=&quot;text-align: justify;&quot;&gt;Dradis is an open source framework to enable effective information sharing, specially during security assessments."
"HTTPTunnel","website","HTTPTunnel is a tunneling software that can tunnel network connections through restrictive HTTP proxies over pure HTTP &quot;GET&quot; and &quot;POST&quot; requests."
"airodump-ng-oui-update","website","airodump-ng-oui-update is a small utility included in the aircrack-ng package and is used to download the OUI list from the IEEE."
"Galleta","website","Galleta is a forensic tool that examines the content of cookie files produced by Microsofts Internet Explorer. It parses the file and outputs a field separated that can be loaded in a spreadsheet."
"crowbar","website","Crowbar (formally known as Levye) is a brute forcing tool that can be used during penetration tests. It was developed to brute horse some protocols in a different manner according to other popular brute forcing tools. "
